{
  "task_id": "CT-000012",
  "anomaly_id": "V-JKT-DEF~defective~2026-09-21",
  "variant_id": "V-JKT-DEF",
  "reason": "defective",
  "kind": "batch_check",
  "status": "in_progress",
  "note": "Batch pulled from stock for checks",
  "created_by": "luca",
  "created_at": "2026-09-30T18:45:00Z",
  "updated_at": "2026-09-30T20:45:00Z",
  "done_at": null,
  "return_id": "RET-000105",
  "follow_up": null
}
